{
  "schema_version": "1.0.0",
  "record_type": "openai_ten_proofs_gapcvp_certification_work_package",
  "work_package_id": "OTP-H-GAPCVP-CERT-WP-001",
  "candidate_id": "OPENAI-TEN-PROOFS-001",
  "result_family": "OTP-H-GAPCVP",
  "tracker_issue": "https://github.com/grandchallenge/MATHCERT/issues/148",
  "status": "authorized_after_protected_mathcert_merge",
  "authority": {
    "protected_mathcert_base": "54b883bb5c6ffaf099efd7270df3519a45b13038",
    "predecessor_work_package": {
      "work_package_id": "OTP-A-SPHERE-PACKING-CERT-WP-001",
      "protected_merge": "54b883bb5c6ffaf099efd7270df3519a45b13038",
      "path": "governance/result_family_work_package_successors/OTP-A-SPHERE-PACKING-CERT-WP-001.json",
      "digest_algorithm": "git_blob_sha1",
      "digest": "f0c91d1959035f35843c383920dfba0b6c24b485"
    },
    "cert_intake_merge": "ff9fa0a67a5a809f3519e0059f2ef9b082b1febb",
    "cert_intake_reviewed_head": "9b64cccdc791ffddcac076eae1c30a40f53cc5dd",
    "cert_intake_review": {
      "review_id": "PRR_kwDOSuU7Ic8AAAABJ39O_g",
      "reviewer": "jimsteeg",
      "state": "APPROVED",
      "submitted_at": "2026-08-18T05:46:42Z"
    },
    "intake_record": {
      "repository": "grandchallenge/MATHCERT",
      "commit_sha": "ff9fa0a67a5a809f3519e0059f2ef9b082b1febb",
      "path": "governance/result_family_intake_successors/OTP-H-GAPCVP.json",
      "digest_algorithm": "git_blob_sha1",
      "digest": "a171482c04f62134812ed6084e19a9b803db3478"
    },
    "solve_handoff_merge": "e42c48dfe6a83eb19f398ba114f61fd700694ce5",
    "producer_packet": {
      "repository": "grandchallenge/MATHSOLVE",
      "commit_sha": "e42c48dfe6a83eb19f398ba114f61fd700694ce5",
      "path": "work_packages/OPENAI_TEN_PROOFS_WP00/result_family_handoff_successors/OTP-H-GAPCVP.json",
      "digest_algorithm": "git_blob_sha1",
      "digest": "0dd2b38e40a126a1a2a2d57989038f788b8e40e4"
    },
    "forge_semantic": {
      "repository": "grandchallenge/MATHFORGE",
      "commit_sha": "b9dda1a5b958fd1be37a26324a025013a39584c1",
      "path": "sources/OPENAI-TEN-PROOFS-001/semantic/OTP-H-GAPCVP/audit_record.json",
      "digest_algorithm": "git_blob_sha1",
      "digest": "673f541fbb552d307cc226c51d2f0fd2916b328d"
    },
    "source_pdf": {
      "revision": "2026-08-06",
      "sha256": "ebc561ab5c53dbd240e17a8fdb6fffeb648591eca85dbfc7466f563638f8c566",
      "byte_length": 2487031,
      "successor_record_blob": "02d1748abed36717afba46451330be165c076737"
    },
    "official_subject": {
      "repository": "openai/ten-proofs",
      "commit": "94bc0feb6a9ff12c7d31d6de640a725c9d43d2b6",
      "tree": "174289e4d4958cb0509874e6e53400e098213de7",
      "formal_successor_record_blob": "6993ce9fac2c65ffae7f2a0c7d728aab828ed532",
      "config_path": "ComparatorChallenges/H_GapCVP.json",
      "config_blob": "fdba0e774acc6c2bd6fd450ee155975c0eda1833",
      "challenge_path": "ComparatorChallenges/H_GapCVP.lean",
      "challenge_blob": "770e202350a5c94d3f6516428ff01092cb8f8cb4",
      "solution_path": "GapCVP.lean",
      "solution_blob": "47f3a395e4d9ec3e2892664860f26ed63421b0c9",
      "lake_manifest_blob": "046e8de7f46832fbf092e3fb815efae01e4a2129",
      "lean_toolchain_blob": "94b9f495baff80fd9cb44aad8f4762cb3b2066fe"
    },
    "source_root_replay": {
      "run_id": 31945652355,
      "job_id": 95161117067,
      "result": "comparator_lean_kernel_nanoda_accept"
    }
  },
  "toolchain": {
    "lean": "leanprover/lean4:v4.32.0",
    "lean_commit": "8c9756b28d64dab099da31a4c09229a9e6a2ef35",
    "comparator_commit": "07bc4ea40f2266dcb861820a2ec1fa3244ed307f",
    "mathlib_commit": "81a5d257c8e410db227a6665ed08f64fea08e997",
    "mathlib_tm_path": "Mathlib/Computability/TuringMachine/Computable.lean",
    "mathlib_tm_blob": "7779a00f0c3c3909923a5f1bde6b3120b5c2d28a",
    "lean4export_commit": "4e7915201d3f9f04470d9eae002fa695f7cdc589",
    "lean4checker_commit": "b7398199245524275543dec6113229c9bb4902e5",
    "nanoda_commit": "ddfac2bf5a7b56cb46e141494427ff3dd55963c7",
    "landrun_commit": "811cfff51ceaf3d9843708aa6d22e9b84ccac8b4",
    "checkout_action_commit": "3d3c42e5aac5ba805825da76410c181273ba90b1",
    "lean_action_commit": "138a564e38a62ce545e8d47d86a97628463aced4",
    "observed_helper_sha256": {
      "landrun": "a4ba9ed1b6b53f9cfd57b9fb1e4f8f3c3ab69cf6a0147764ff70303a8306f858",
      "lean4export": "e57369980b0b81228580ce08066fb9bd738e717e002673a143f4956d217266b0",
      "nanoda_bin": "60cc30add2758abce965f122b4e85f1fdd7c23607ea67680cec6721aa2ef23f0",
      "landrun_argv_adapter": "84d900d75bdc76c2c4168484a929e448be36fca20d093c42cac15ed923fe3f1d"
    }
  },
  "execution_contract": {
    "allowed_after_protected_activation": true,
    "isolated_family_replay_required": true,
    "clean_room_environment_required": true,
    "aggregate_import_required": false,
    "comparator_config": "ComparatorChallenges/H_GapCVP.json",
    "challenge_module": "ComparatorChallenges.H_GapCVP",
    "solution_module": "GapCVP",
    "machine_model": "deterministic_polynomial_time_many_one_promise_hardness",
    "permitted_axioms": ["propext", "Classical.choice", "Quot.sound"],
    "deterministic_commands": [
      "lake exe cache get",
      "lake build GapCVP",
      "lake exe comparator ComparatorChallenges/H_GapCVP.json"
    ],
    "expected_outputs": [
      "Nanoda kernel accepts the solution",
      "Lean default kernel accepts the solution",
      "Your solution is okay!",
      "OTP_SUCCESSOR_COMPARATOR=ACCEPT"
    ],
    "expected_exported_target_count": 4,
    "expected_exported_promise_definition_count": 4,
    "challenge_sorry_warnings_expected": true,
    "challenge_sorry_warnings_are_not_solution_authority": true,
    "required_artifacts": [
      "environment_manifest",
      "source_identity_report",
      "family_replay_log",
      "target_and_promise_export_report",
      "comparator_result",
      "lean_kernel_result",
      "nanoda_result",
      "theorem_axiom_report",
      "semantic_concordance_attestation",
      "promise_nonvacuity_attestation",
      "trust_boundary_scan",
      "repository_owned_evidence_bundle",
      "independent_review_attestation"
    ],
    "failure_conditions": [
      "content_addressed_source_or_toolchain_identity_mismatch",
      "target_or_promise_membership_or_order_drift",
      "non_permitted_axiom_present",
      "gapcvp_build_failure",
      "nanoda_kernel_reject",
      "lean_default_kernel_reject",
      "comparator_non_accept",
      "gap_exponent_or_norm_or_strictness_drift",
      "promise_restriction_erasure_or_totalization",
      "source_derived_classification_drift",
      "mandatory_qualification_erasure",
      "nonvacuity_evidence_erasure",
      "route_adjudication_output_proof_or_aggregate_authority_inflation"
    ]
  },
  "target_scope": {
    "lean_theorems": [
      "GapCVP.Comparator.gapCVP400IsNPHard",
      "GapCVP.Comparator.binaryNearestCodewordIsNPHard",
      "GapCVP.Comparator.binarySyndromeDecodingIsNPHard",
      "GapCVP.Comparator.finitePNormGapCVPIsNPHard"
    ],
    "promise_interfaces": [
      "GapCVP.Comparator.gapCVP400Promise",
      "GapCVP.Comparator.binaryNearestCodewordPromise",
      "GapCVP.Comparator.binarySyndromeDecodingPromise",
      "GapCVP.Comparator.finitePGapCVPPromise"
    ],
    "classifications": [
      "source_faithful_restricted_consequence_integer_target",
      "source_faithful_up_to_generator_orientation",
      "source_faithful_restricted_consequence_consistent_syndrome",
      "source_faithful_fixed_rational_p_consequence"
    ],
    "gap_factors": ["n^(1/400)", "n^(1/200)", "n^(1/200)", "n^(1/(200p))"],
    "mandatory_qualifications": [
      "400, 200 and 200p are exponent denominators in dimension-dependent gaps, not constant approximation factors.",
      "The Euclidean formal promise is restricted to integer targets, matching the source Theorem 1 reduction output rather than the source's most general rational-target interface.",
      "The syndrome NO side is restricted to consistent systems sufficient for the source Corollary 15 reduction.",
      "Binary generator row/column orientation is treated only as a transpose convention preserving the represented code.",
      "Malformed/non-encoding and threshold-intermediate bitstrings remain outside the promise.",
      "The finite-p theorem parameter p is fixed rational with 1 <= p and is external to the input encoding.",
      "Forge replay and semantic admission do not independently certify NP-hardness proof correctness."
    ],
    "nonvacuity": {
      "state": "clear_all_four_promise_interfaces",
      "yes_witness_count": 4,
      "no_witness_count": 4,
      "witnesses": [
        {
          "promise": "GapCVP.Comparator.gapCVP400Promise",
          "yes": "dimension 1, B=(1), t=0, r=1, z=0 gives distance 0",
          "no": "dimension 1, B=(2), t=1, r=1/2; every even lattice point is at distance at least 1 and the dimension-1 gap factor is 1"
        },
        {
          "promise": "GapCVP.Comparator.binaryNearestCodewordPromise",
          "yes": "blockLength 1 zero code, zero target, radius 1 has distance 0",
          "no": "blockLength 2 zero code C={00}, target 11, radius 1 has Hamming distance 2, strictly above 2^(1/200)"
        },
        {
          "promise": "GapCVP.Comparator.binarySyndromeDecodingPromise",
          "yes": "blockLength 1, H=[0], b=0, radius 1, word 0 is a solution of weight 0",
          "no": "blockLength 2, H=I_2, b=11, radius 1 has the unique solution 11 of weight 2, strictly above 2^(1/200)"
        },
        {
          "promise": "GapCVP.Comparator.finitePGapCVPPromise",
          "yes": "dimension 1, B=(1), t=0, r=1 has l_p distance 0 for every fixed p>=1",
          "no": "dimension 1, B=(2), t=1, r=1/2 has l_p distance 1 for every fixed finite p>=1; n=1 makes the gap factor 1"
        }
      ]
    },
    "target_acceptance": [
      {
        "theorem": "GapCVP.Comparator.gapCVP400IsNPHard",